{"b0_evidence":{"authority_commit":"77f6db99019eb3e24e7b20ac92a2463a3bb3156c","inventory_path":"contracts/system-contracts/common-system-decision-inventory.json","inventory_raw_sha256":"sha256:b9ce518e6941ea60937982c56ab3efa2e6e0d7a7fb462b69890232a0f5564cff","provenance_path":"contracts/system-contracts/common-system-provenance.json","provenance_raw_sha256":"sha256:f430fb6c5245449b8e10aa1377cc368ce0c9b4f59b6b4a00acfa1b0e59ca3566"},"contract_version":"2.1.3","format":"autocut.common-system-direct-contribution/v1","foundation_input":{"handoff_git_commit":"168b71d9fa9d20e9c2dc1061f80073ac0a0078de","handoff_raw_sha256":"sha256:c0be3d51e1ff8d8bd6fa1a5a8e907832e6bb58816fb4b6137776bd9abca57c2d","producer_git_commit":"1fd66f6598b950b19349a44113569c04e840a84f"},"not_selected":[{"authority_change_ids":["AC-B-007"],"candidate_id":"B0-003","disposition":"authority_change_required","owner":"common"},{"authority_change_ids":["AC-B-007"],"candidate_id":"B0-004","disposition":"authority_change_required","owner":"common"},{"authority_change_ids":[],"candidate_id":"B0-012","disposition":"awaiting_owner","owner":"stage_01_stage_02_stage_03_stage_04"},{"authority_change_ids":["AC-B-009"],"candidate_id":"B0-013","disposition":"awaiting_owner","owner":"commands"},{"authority_change_ids":["AC-B-009"],"candidate_id":"B0-014","disposition":"awaiting_owner","owner":"commands"},{"authority_change_ids":["AC-B-009"],"candidate_id":"B0-015","disposition":"awaiting_owner","owner":"commands"},{"authority_change_ids":["AC-B-003"],"candidate_id":"B0-016","disposition":"authority_change_required","owner":"common"},{"authority_change_ids":["AC-B-009"],"candidate_id":"B0-017","disposition":"awaiting_owner","owner":"commands"},{"authority_change_ids":["AC-B-004","AC-B-009"],"candidate_id":"B0-018","disposition":"authority_change_required","owner":"common"},{"authority_change_ids":["AC-B-004"],"candidate_id":"B0-019","disposition":"authority_change_required","owner":"common"},{"authority_change_ids":["AC-B-005"],"candidate_id":"B0-020","disposition":"authority_change_required","owner":"common"},{"authority_change_ids":["AC-B-005"],"candidate_id":"B0-021","disposition":"authority_change_required","owner":"common"},{"authority_change_ids":["AC-B-005"],"candidate_id":"B0-022","disposition":"authority_change_required","owner":"common"},{"authority_change_ids":["AC-B-005"],"candidate_id":"B0-023","disposition":"authority_change_required","owner":"common"},{"authority_change_ids":["AC-B-005"],"candidate_id":"B0-024","disposition":"authority_change_required","owner":"common"},{"authority_change_ids":["AC-B-005"],"candidate_id":"B0-025","disposition":"authority_change_required","owner":"common"},{"authority_change_ids":["AC-B-006"],"candidate_id":"B0-026","disposition":"authority_change_required","owner":"common"},{"authority_change_ids":["AC-B-006"],"candidate_id":"B0-027","disposition":"authority_change_required","owner":"common"},{"authority_change_ids":["AC-B-008"],"candidate_id":"B0-028","disposition":"authority_change_required","owner":"unresolved_common_or_stage_04"},{"authority_change_ids":[],"candidate_id":"B0-029","disposition":"awaiting_owner","owner":"stage_05"},{"authority_change_ids":[],"candidate_id":"B0-030","disposition":"awaiting_owner","owner":"stage_05"},{"authority_change_ids":[],"candidate_id":"B0-031","disposition":"awaiting_owner","owner":"stage_05"},{"authority_change_ids":[],"candidate_id":"B0-032","disposition":"awaiting_owner","owner":"publication"},{"authority_change_ids":[],"candidate_id":"B0-033","disposition":"awaiting_owner","owner":"publication"},{"authority_change_ids":[],"candidate_id":"B0-034","disposition":"awaiting_owner","owner":"publication"},{"authority_change_ids":[],"candidate_id":"B0-035","disposition":"awaiting_owner","owner":"publication"},{"authority_change_ids":[],"candidate_id":"B0-036","disposition":"awaiting_owner","owner":"publication"},{"authority_change_ids":[],"candidate_id":"B0-037","disposition":"awaiting_owner","owner":"publication"},{"authority_change_ids":[],"candidate_id":"B0-038","disposition":"awaiting_owner","owner":"publication"},{"authority_change_ids":[],"candidate_id":"B0-039","disposition":"awaiting_owner","owner":"publication"},{"authority_change_ids":[],"candidate_id":"B0-040","disposition":"awaiting_owner","owner":"publication"},{"authority_change_ids":[],"candidate_id":"B0-041","disposition":"awaiting_owner","owner":"publication"},{"authority_change_ids":[],"candidate_id":"B0-042","disposition":"awaiting_owner","owner":"publication"},{"authority_change_ids":[],"candidate_id":"B0-043","disposition":"awaiting_owner","owner":"publication"},{"authority_change_ids":["AC-B-001","AC-B-002","AC-B-009"],"candidate_id":"B0-044","disposition":"authority_change_required","owner":"common"}],"producer_base_commit":"8c7e2b0ceb38673c6f62f7c4af44d5dfa222fdbe","selected":[{"acceptance":"closed_payload_source_only","authority_evidence":{"historical_schema_comment":["Authority: v2-production-system-contracts.md#4.1; sha256:7260bf922f8852ea22142220227fdda9a4e03e81433592c68957dffe08b7531d"],"reattested":["B0 reattestation at authority commit 77f6db99019eb3e24e7b20ac92a2463a3bb3156c; production-system-contracts.md#4.1; sha256:c34af7451919ad9a895644b40136062834b7ba9e857139f10b61f7dc51be67e9"]},"candidate_id":"B0-001","deferred_semantics":["No Registry, artifact/type identity, Store/CAS, producer/writer, scope, ordering, or admission semantics are asserted."],"source_jcs_sha256":"sha256:2bb5caecc6eb913bb8d7dfa2b5831f23a19193f1b95f887f6ec96e75d95054b3","source_path":"schemas/primitives/artifact-ref.schema.json","source_raw_sha256":"sha256:9df321d5ccc33dd8ff307aae6f33d1e4d2accfc278ea4fb5ed11072e5e5295db","test_paths":[{"path":"tests/contracts/test_shared_primitives.py","raw_sha256":"sha256:2b71f5bdae891ab8afa4a8190940d649815925f57cf5cff4644de7a61d66ca6b"}]},{"acceptance":"closed_payload_source_only","authority_evidence":{"historical_schema_comment":["Authority: v2-production-system-contracts.md#4.1; sha256:7260bf922f8852ea22142220227fdda9a4e03e81433592c68957dffe08b7531d"],"reattested":["B0 reattestation at authority commit 77f6db99019eb3e24e7b20ac92a2463a3bb3156c; production-system-contracts.md#4.1; sha256:c34af7451919ad9a895644b40136062834b7ba9e857139f10b61f7dc51be67e9"]},"candidate_id":"B0-002","deferred_semantics":["No Registry, artifact/type identity, Store/CAS, producer/writer, scope, ordering, or admission semantics are asserted."],"source_jcs_sha256":"sha256:1e75dba26cdd05ac72c13c78519b14939e7486133e32ff689e6ec62a4315ca49","source_path":"schemas/primitives/artifact-set-ref.schema.json","source_raw_sha256":"sha256:ddbbaf9bb866c97fa5c4ee9bbe1f78053f03a09abed529846bc5a3b0893a97a4","test_paths":[{"path":"tests/contracts/test_shared_primitives.py","raw_sha256":"sha256:2b71f5bdae891ab8afa4a8190940d649815925f57cf5cff4644de7a61d66ca6b"}]},{"acceptance":"closed_payload_source_only","authority_evidence":{"historical_schema_comment":["Authority: v2-production-system-contracts.md#4.1; sha256:7260bf922f8852ea22142220227fdda9a4e03e81433592c68957dffe08b7531d"],"reattested":["B0 reattestation at authority commit 77f6db99019eb3e24e7b20ac92a2463a3bb3156c; production-system-contracts.md#4.1; sha256:c34af7451919ad9a895644b40136062834b7ba9e857139f10b61f7dc51be67e9"]},"candidate_id":"B0-005","deferred_semantics":["No Registry, artifact/type identity, Store/CAS, producer/writer, scope, ordering, or admission semantics are asserted."],"source_jcs_sha256":"sha256:6ccb54c7e407aa6cf807e6effe1d5b53f1cd78016f7678938cd38595fa90d6ff","source_path":"schemas/primitives/domain-ref.schema.json","source_raw_sha256":"sha256:72211809fa19f967345ccc41574fea5319feb40bcbde05a3564cf6bc8c63f896","test_paths":[{"path":"tests/contracts/test_shared_primitives.py","raw_sha256":"sha256:2b71f5bdae891ab8afa4a8190940d649815925f57cf5cff4644de7a61d66ca6b"}]},{"acceptance":"closed_payload_source_only","authority_evidence":{"historical_schema_comment":["Authority: v2-production-system-contracts.md#4.1; sha256:7260bf922f8852ea22142220227fdda9a4e03e81433592c68957dffe08b7531d"],"reattested":["B0 reattestation at authority commit 77f6db99019eb3e24e7b20ac92a2463a3bb3156c; production-system-contracts.md#4.1; sha256:c34af7451919ad9a895644b40136062834b7ba9e857139f10b61f7dc51be67e9"]},"candidate_id":"B0-006","deferred_semantics":["No Registry, artifact/type identity, Store/CAS, producer/writer, scope, ordering, or admission semantics are asserted."],"source_jcs_sha256":"sha256:6a2a633ebe428d8f81788e41a40ba753df4787d16fa81fa8edbca6093924969b","source_path":"schemas/primitives/immutable-blob-ref.schema.json","source_raw_sha256":"sha256:52d4ea27825976cecc86e2d96d2388acb0aa885799adb708d6f0db616cc10678","test_paths":[{"path":"tests/contracts/test_shared_primitives.py","raw_sha256":"sha256:2b71f5bdae891ab8afa4a8190940d649815925f57cf5cff4644de7a61d66ca6b"}]},{"acceptance":"closed_payload_source_only","authority_evidence":{"historical_schema_comment":["Authority: v2-production-system-contracts.md#4.2; sha256:7260bf922f8852ea22142220227fdda9a4e03e81433592c68957dffe08b7531d"],"reattested":["B0 reattestation at authority commit 77f6db99019eb3e24e7b20ac92a2463a3bb3156c; production-system-contracts.md#4.1; sha256:c34af7451919ad9a895644b40136062834b7ba9e857139f10b61f7dc51be67e9"]},"candidate_id":"B0-007","deferred_semantics":["No Registry, artifact/type identity, Store/CAS, producer/writer, scope, ordering, or admission semantics are asserted."],"source_jcs_sha256":"sha256:c156211243ca35e6c2b85fc31b6eafb6b453efa20f72128746499dee76bd33eb","source_path":"schemas/primitives/scope.schema.json","source_raw_sha256":"sha256:e0376bbb53ea1ddcc69b371231fb81d2bd948f7f52565e452df413e9499b53ac","test_paths":[{"path":"tests/contracts/test_shared_primitives.py","raw_sha256":"sha256:2b71f5bdae891ab8afa4a8190940d649815925f57cf5cff4644de7a61d66ca6b"}]},{"acceptance":"closed_payload_source_only","authority_evidence":{"historical_schema_comment":["Authority: v2-production-system-contracts.md#1.1.1,#